{
  "schema": "larena.ui.smart_view",
  "schema_version": 1,
  "component": "ui.button",
  "view": "default",
  "template": "default",
  "props": {"text": "Apply", "size": "1", "type": "default", "scheme": "primary", "loading": false, "disabled": false, "native-type": "submit", "aria-label": "Apply"},
  "presets": {},
  "modifiers": {},
  "children": {},
  "constraints": {}
}
