{
  "schema": "larena.ui.smart_view",
  "schema_version": 1,
  "component": "dataview.toolbar",
  "view": "default",
  "template": "default",
  "props": {},
  "presets": {},
  "modifiers": {},
  "children": {
    "saved_view": {
      "component": "ui.dropdown",
      "view": "default",
      "preset": null,
      "modifiers": [],
      "slot": "options",
      "props": {"size": "1", "type": "outlined", "mode": "select", "multiple": false, "portal": false, "value": "current-query", "name": "saved_view_id", "label": "Saved view", "required": false, "placeholder": "Saved view", "search-placeholder": "Find saved view", "search": false, "disabled": false, "aria-label": "Saved view", "id": "dataview-saved-view", "options": [{"text": "Current query", "value": "current-query", "type": "text", "size": "1", "selected": true, "disabled": false, "aria-label": "Current query"}]},
      "children": {}
    },
    "search": {
      "component": "ui.input",
      "view": "default",
      "preset": null,
      "modifiers": [],
      "slot": "search",
      "props": {"id": "dataview-search", "name": "search", "label": "Search", "value": "", "required": false, "type": "bordered", "size": "1", "disabled": false, "error": false, "hint": ""},
      "children": {}
    },
    "query_options": {
      "component": "dataview.query_options",
      "view": "default",
      "preset": null,
      "modifiers": [],
      "slot": "options",
      "props": {"title": "Filter and sort", "expanded": false},
      "children": {}
    },
    "submit": {
      "component": "ui.button",
      "view": "default",
      "preset": null,
      "modifiers": [],
      "slot": "actions",
      "props": {"text": "Apply", "size": "1", "type": "default", "scheme": "primary", "loading": false, "disabled": false, "native-type": "submit", "aria-label": "Apply table query"},
      "children": {}
    },
    "create": {
      "component": "ui.button",
      "view": "default",
      "preset": null,
      "modifiers": [],
      "slot": "actions",
      "props": {"text": "Create item", "size": "1", "type": "default", "scheme": "primary", "loading": false, "disabled": true, "native-type": "button", "aria-label": "Create item", "id": "dataview-create-item"},
      "children": {}
    }
  },
  "constraints": {"server_composed": true}
}
