{
  "schema": "larena.ui.smart_view",
  "schema_version": 1,
  "component": "ui.pagination",
  "view": "default",
  "template": "default",
  "props": {"current": 1, "total": 1, "top": false, "bottom": true, "show-more-text": "Show more", "selected-label": "Selected:", "total-label": "Total:", "pages-label": "Pages:", "previous-label": "Previous page", "page-label": "Page", "next-label": "Next page", "last-label": "Last", "page-size-label": "Items per page", "aria-label": "Page navigation", "id": "smart-pagination"},
  "presets": {},
  "modifiers": {},
  "children": {},
  "constraints": {}
}
