{
  "schema": "larena.ui.smart_view",
  "schema_version": 1,
  "component": "admin.record_editor",
  "view": "default",
  "template": "default",
  "props": {"title": "Record", "mode": "create", "expanded": false},
  "presets": {},
  "modifiers": {},
  "children": {},
  "constraints": {"server_composed": true, "dynamic_fields": true}
}
