{
  "schema": "larena.ui.smart_view",
  "schema_version": 1,
  "component": "ui.dataview",
  "view": "default",
  "template": "default",
  "props": {},
  "presets": {},
  "modifiers": {},
  "children": {},
  "constraints": {"server_data_required": true, "presentation_controls_only": true, "backend_effect_binding": false}
}
